Startup name,Country,Basic problem,Differentiator,Core product description,Main AI / data advantage,Latest Funding Amount,Latest Funding Date,,,
Primer,USA,Intelligence analysts face info overload across multiple languages and sources – missing critical links or spending too long summarizing reports,"AI platform that reads and summarizes vast amounts of open-source text, and discovers connections, so analysts get key insights without manual reading","Processes news, social media, research documents in real time, auto-generating summaries and briefing books on topics or entities (e.g., merging all sources on a security incident into one narrative) and highlighting networks (like which groups are mentioned together frequently)","Uses advanced NLP for cross-lingual understanding and summarization plus a knowledge graph to maintain context – essentially doing hours of reading and analysis in seconds (and in any major language), and even proactively alerting on emerging narratives or threats, which massively amplifies what one analyst can cover",USD 110M,May 2021,,,
Remesh,USA,"Traditional focus groups gather deep insight but are slow, while surveys are fast but shallow – getting qualitative depth at quantitative scale is tough",AI-driven platform where AI facilitates a 'mass focus group' – engaging hundreds of participants and synthesizing their feedback on the fly,"One moderator can ask an open-ended question to, say, 500 consumers simultaneously; the AI analyzes all the responses as they come in, clusters them by sentiment and theme, and delivers insights (like top concerns or percentage agreement) during the live session","Real-time NLP clustering and sentiment analysis allow it to identify in seconds what would take a human researcher days of coding transcripts – you get top themes, representative quotes from each opinion cluster, and consensus metrics instantly, enabling truly agile qualitative research",USD 4.25M (Debt),30 Dec 2022,,,
Visualping,Canada,"Professionals need to know immediately when specific webpages change (e.g., competitor pricing page, regulation page) but can't monitor 24/7 themselves",Simple website change detection tool with smart alerting,Users enter a URL and what to watch (full page or section) – Visualping checks it at chosen intervals and emails an alert with highlights whenever a change is detected,"Its ease-of-use and cloud scale are key, and it's adding AI to filter out trivial changes (like formatting) vs important content changes, so users get high-signal alerts only; this automation ensures no critical web updates are missed, without manual checking",USD 6M,16 Jul 2021,,,
Geti (Retail Intelligence),Chile,"Retailers in emerging markets lack competitive pricing and assortment data, making it hard to optimize their strategy against competitors",Retail competitive intelligence platform focused on pricing and catalog monitoring (including niche sectors like Latin American e-commerce),"Continuously collects competitors’ product prices, promotions, stock availability from online and offline channels and provides analytics on price position, assortment gaps, and market share trends","Combines web scraping, crowdsourced data, and ML-based inference to fill missing data points, providing a near-complete market picture; its AI module can even simulate pricing moves on market share to guide strategy, bringing a level of data-driven decision support previously unavailable in these markets",N/A,,,,
Aisera,USA,"IT and customer support teams get overwhelmed with repetitive queries and tasks that could be automated, but legacy chatbots can’t handle complex requests",AI service desk/copilot that auto-resolves requests by understanding intent and executing actions across systems,"Handles internal IT queries (password resets, VPN issues) or customer support (order status, refunds) by conversing naturally and directly integrating with backend systems to perform the needed action or retrieve answers – often resolving issues without human intervention","Uses advanced conversational AI (pre-trained on IT and support dialogs) combined with RPA-like workflow automation; it not only comprehends multi-turn, context-rich queries but also knows when to escalate to a human and learns from each interaction, continuously improving resolution rates – effectively reducing helpdesk workloads dramatically",USD 90M,24 Jan 2023,,,
Harvey,USA,"Lawyers spend huge amounts of time on research and drafting, much of which involves repetitive analysis of legal text that AI could handle","AI legal assistant built on GPT-4, fine-tuned for legal tasks (research memos, contract analysis, drafting) for law firms","Lawyers can ask Harvey complex legal questions (e.g., summarizing how a case law applies to their situation) or have it review a contract and flag issues, or even generate first-draft contracts or court filings tailored to specific jurisdictions, significantly speeding up legal workflows","Customized LLM that understands legal context, terminology, and tone – it produces output that is far more accurate and useful for legal professionals than a generic AI, functioning like an extremely well-read junior attorney who can comb through millions of pages of law in seconds and produce coherent arguments or insights – enabling lawyers to focus on strategy and judgment rather than rote drafting",USD 21M,14 Mar 2023,,,
Exploding Topics,USA,"Entrepreneurs and marketers want to spot rising trends early, but it’s hard to filter the signal from noise online",Trend-spotting tool using algorithms (and AI) to surface topics with surging interest before they go mainstream,"Scans search queries, social mentions, and other online data to identify products or topics 'exploding' in interest, providing short insight reports on each trend",Algorithmic detection of fast-growing topics plus new AI clustering to group related keywords and predict trend staying power – essentially automating an analyst’s early trend scouting,N/A,,,,
Akkio,USA,Small businesses have valuable data but lack data science expertise to build predictive models from it,No-code automated machine learning platform that allows anyone to create predictive models from spreadsheet data in minutes,"Users connect datasets (e.g., CRM exports) and select a target (like churn or lead conversion) – Akkio’s AI then builds a model and provides predictions and insights via a simple UI or API","Fully automated ML pipeline and easy integration – under the hood it uses AutoML and shapley-value explanations, but to the user it feels like an intuitive app, enabling advanced predictions without any coding or ML knowledge",USD 2.1M,2021,,,
G2 (AI features),USA,Software buyers are overwhelmed by thousands of user reviews and need quick summaries to make decisions,Established software review marketplace that added an AI analyst (Monty) to synthesize review insights and competitive comparisons automatically,"G2’s platform now uses AI to summarize pros/cons and common themes from all user reviews of a product, and can generate side-by-side competitor comparisons from review data, reducing manual research for buyers","NLP on a massive corpus of tech reviews provides unbiased, data-driven summaries in seconds; the AI can read thousands of opinions and distill what users consistently like or dislike about each tool, which helps buyers and also gives vendors feedback at a glance",N/A,(AI launched 2023; G2 total funding $257M),,,
Watchful,New Zealand,"Product teams find it difficult to keep track of competitors’ frequent app or UX updates, especially in mobile apps, which can indicate strategic changes",Automated product change monitoring (esp. mobile apps) that uses computer vision to detect UI/feature changes and alert teams,"Captured regular screenshots of competitors’ apps and websites (including behind logins) and used AI to highlight what changed (new buttons, removed features), enabling companies to catch new feature launches or experiments by competitors quickly","Visual AI allowed it to monitor UX changes at scale that would be impossible manually; by interpreting screenshots and UI elements with ML, it could not only flag changes but categorize them (e.g., a new payment option added), effectively revealing competitors’ roadmap moves (Tech acquired by ThoughtWorks in 2023)",USD 3M,3 Jun 2020,,,
NetBase Quid,USA,"Market researchers and strategists struggle to synthesize insights from huge volumes of unstructured data (news, social posts, forums) to see the big picture",AI-powered research platform that analyzes and visualizes narratives and trends by examining connections in large text datasets,"Combines social listening (NetBase) with AI text analysis (Quid) to cluster conversations and articles into themes, so users can literally see a map of trends or public opinion drivers in their industry","Advanced natural language processing and network graph algorithms group millions of documents by semantic similarity, revealing hidden relationships and emerging topics that traditional keyword analytics would miss – providing a bird’s-eye view of any topic’s discussion landscape",USD 39M (Quid pre-merger),2018 (merged with NetBase in 2019),,,